{
  "catalog_version": "0.1.0",
  "last_updated": "2026-10-07",
  "layer": "original_abstract",
  "source_note": "Common English reference labels for the classical Thirty-Six Stratagems; translations vary. This layer is heuristic only and is not used as legal authority or the preferred operational pattern source.",
  "patterns": [
    {
      "stratagem_id": "original:01",
      "number": 1,
      "chinese_label": "瞞天過海",
      "common_english_label": "Deceive the heavens to cross the sea",
      "layer": "original_abstract",
      "operational_role": "reference_only",
      "adapted_analogue_id": "adapted:01",
      "limitations": [
        "This common English rendering is retained only as an abstract philosophical reference.",
        "It is not legal authority, evidence, or the preferred source for operational candidate generation.",
        "Where the adapted analogue differs operationally, the adapted analogue governs."
      ]
    },
    {
      "stratagem_id": "original:02",
      "number": 2,
      "chinese_label": "圍魏救趙",
      "common_english_label": "Besiege Wei to rescue Zhao",
      "layer": "original_abstract",
      "operational_role": "reference_only",
      "adapted_analogue_id": "adapted:02",
      "limitations": [
        "This common English rendering is retained only as an abstract philosophical reference.",
        "It is not legal authority, evidence, or the preferred source for operational candidate generation.",
        "Where the adapted analogue differs operationally, the adapted analogue governs."
      ]
    },
    {
      "stratagem_id": "original:03",
      "number": 3,
      "chinese_label": "借刀殺人",
      "common_english_label": "Kill with a borrowed knife",
      "layer": "original_abstract",
      "operational_role": "reference_only",
      "adapted_analogue_id": "adapted:03",
      "limitations": [
        "This common English rendering is retained only as an abstract philosophical reference.",
        "It is not legal authority, evidence, or the preferred source for operational candidate generation.",
        "Where the adapted analogue differs operationally, the adapted analogue governs."
      ]
    },
    {
      "stratagem_id": "original:04",
      "number": 4,
      "chinese_label": "以逸待勞",
      "common_english_label": "Wait at leisure while the enemy labors",
      "layer": "original_abstract",
      "operational_role": "reference_only",
      "adapted_analogue_id": "adapted:04",
      "limitations": [
        "This common English rendering is retained only as an abstract philosophical reference.",
        "It is not legal authority, evidence, or the preferred source for operational candidate generation.",
        "Where the adapted analogue differs operationally, the adapted analogue governs."
      ]
    },
    {
      "stratagem_id": "original:05",
      "number": 5,
      "chinese_label": "趁火打劫",
      "common_english_label": "Loot a burning house",
      "layer": "original_abstract",
      "operational_role": "reference_only",
      "adapted_analogue_id": "adapted:05",
      "limitations": [
        "This common English rendering is retained only as an abstract philosophical reference.",
        "It is not legal authority, evidence, or the preferred source for operational candidate generation.",
        "Where the adapted analogue differs operationally, the adapted analogue governs."
      ]
    },
    {
      "stratagem_id": "original:06",
      "number": 6,
      "chinese_label": "聲東擊西",
      "common_english_label": "Make a sound in the east, then strike in the west",
      "layer": "original_abstract",
      "operational_role": "reference_only",
      "adapted_analogue_id": "adapted:06",
      "limitations": [
        "This common English rendering is retained only as an abstract philosophical reference.",
        "It is not legal authority, evidence, or the preferred source for operational candidate generation.",
        "Where the adapted analogue differs operationally, the adapted analogue governs."
      ]
    },
    {
      "stratagem_id": "original:07",
      "number": 7,
      "chinese_label": "無中生有",
      "common_english_label": "Create something from nothing",
      "layer": "original_abstract",
      "operational_role": "reference_only",
      "adapted_analogue_id": "adapted:07",
      "limitations": [
        "This common English rendering is retained only as an abstract philosophical reference.",
        "It is not legal authority, evidence, or the preferred source for operational candidate generation.",
        "Where the adapted analogue differs operationally, the adapted analogue governs."
      ]
    },
    {
      "stratagem_id": "original:08",
      "number": 8,
      "chinese_label": "明修棧道，暗渡陳倉",
      "common_english_label": "Openly repair the gallery roads, but sneak through Chencang",
      "layer": "original_abstract",
      "operational_role": "reference_only",
      "adapted_analogue_id": "adapted:08",
      "limitations": [
        "This common English rendering is retained only as an abstract philosophical reference.",
        "It is not legal authority, evidence, or the preferred source for operational candidate generation.",
        "Where the adapted analogue differs operationally, the adapted analogue governs."
      ]
    },
    {
      "stratagem_id": "original:09",
      "number": 9,
      "chinese_label": "隔岸觀火",
      "common_english_label": "Watch the fires burning across the river",
      "layer": "original_abstract",
      "operational_role": "reference_only",
      "adapted_analogue_id": "adapted:09",
      "limitations": [
        "This common English rendering is retained only as an abstract philosophical reference.",
        "It is not legal authority, evidence, or the preferred source for operational candidate generation.",
        "Where the adapted analogue differs operationally, the adapted analogue governs."
      ]
    },
    {
      "stratagem_id": "original:10",
      "number": 10,
      "chinese_label": "笑裏藏刀",
      "common_english_label": "Hide a knife behind a smile",
      "layer": "original_abstract",
      "operational_role": "reference_only",
      "adapted_analogue_id": "adapted:10",
      "limitations": [
        "This common English rendering is retained only as an abstract philosophical reference.",
        "It is not legal authority, evidence, or the preferred source for operational candidate generation.",
        "Where the adapted analogue differs operationally, the adapted analogue governs."
      ]
    },
    {
      "stratagem_id": "original:11",
      "number": 11,
      "chinese_label": "李代桃僵",
      "common_english_label": "Sacrifice the plum tree to preserve the peach tree",
      "layer": "original_abstract",
      "operational_role": "reference_only",
      "adapted_analogue_id": "adapted:11",
      "limitations": [
        "This common English rendering is retained only as an abstract philosophical reference.",
        "It is not legal authority, evidence, or the preferred source for operational candidate generation.",
        "Where the adapted analogue differs operationally, the adapted analogue governs."
      ]
    },
    {
      "stratagem_id": "original:12",
      "number": 12,
      "chinese_label": "順手牽羊",
      "common_english_label": "Take the opportunity to pilfer a goat",
      "layer": "original_abstract",
      "operational_role": "reference_only",
      "adapted_analogue_id": "adapted:12",
      "limitations": [
        "This common English rendering is retained only as an abstract philosophical reference.",
        "It is not legal authority, evidence, or the preferred source for operational candidate generation.",
        "Where the adapted analogue differs operationally, the adapted analogue governs."
      ]
    },
    {
      "stratagem_id": "original:13",
      "number": 13,
      "chinese_label": "打草驚蛇",
      "common_english_label": "Stomp the grass to scare the snake",
      "layer": "original_abstract",
      "operational_role": "reference_only",
      "adapted_analogue_id": "adapted:13",
      "limitations": [
        "This common English rendering is retained only as an abstract philosophical reference.",
        "It is not legal authority, evidence, or the preferred source for operational candidate generation.",
        "Where the adapted analogue differs operationally, the adapted analogue governs."
      ]
    },
    {
      "stratagem_id": "original:14",
      "number": 14,
      "chinese_label": "借屍還魂",
      "common_english_label": "Borrow a corpse to resurrect the soul",
      "layer": "original_abstract",
      "operational_role": "reference_only",
      "adapted_analogue_id": "adapted:14",
      "limitations": [
        "This common English rendering is retained only as an abstract philosophical reference.",
        "It is not legal authority, evidence, or the preferred source for operational candidate generation.",
        "Where the adapted analogue differs operationally, the adapted analogue governs."
      ]
    },
    {
      "stratagem_id": "original:15",
      "number": 15,
      "chinese_label": "調虎離山",
      "common_english_label": "Lure the tiger down the mountain",
      "layer": "original_abstract",
      "operational_role": "reference_only",
      "adapted_analogue_id": "adapted:15",
      "limitations": [
        "This common English rendering is retained only as an abstract philosophical reference.",
        "It is not legal authority, evidence, or the preferred source for operational candidate generation.",
        "Where the adapted analogue differs operationally, the adapted analogue governs."
      ]
    },
    {
      "stratagem_id": "original:16",
      "number": 16,
      "chinese_label": "欲擒故縱",
      "common_english_label": "In order to capture, one must let loose",
      "layer": "original_abstract",
      "operational_role": "reference_only",
      "adapted_analogue_id": "adapted:16",
      "limitations": [